{
    "$schema": "../handler-schema.json",
    "name": "GitHub",
    "server": {
        "http": "https://github.com",
        "ssh": "git@github.com"
    },
    "branch": ["rev-parse", "--abbrev-ref"],
    "url": "{{ base }}/{{ repository }}/blob/{{ ref | uri }}/{{ file | uri }}",
    "selection": "#L{{ startLine }}{% if startLine != endLine %}-L{{ endLine }}{% endif %}",
    "tests": {
        "createUrl": {
            "remotes": {
                "http": "https://github.com/foo/bar.git",
                "httpWithUsername": "https://username@github.com/foo/bar.git",
                "ssh": "git@github.com:foo/bar.git",
                "sshWithProtocol": "ssh://git@github.com:foo/bar.git",
                "result": "https://github.com/foo/bar/blob/master/src/file.txt"
            },
            "spaces": {
                "remote": "https://github.com/foo/bar.git",
                "result": "https://github.com/foo/bar/blob/master/src/path%20spaces/file%20spaces.txt"
            },
            "branch": {
                "remote": "https://github.com/foo/bar.git",
                "result": "https://github.com/foo/bar/blob/feature/test/src/file.txt"
            },
            "commit": {
                "remote": "https://github.com/foo/bar.git",
                "result": "https://github.com/foo/bar/blob/{{ commit }}/src/file.txt"
            },
            "selection": {
                "remote": "https://github.com/foo/bar.git",
                "point": {
                    "line": 10,
                    "result": "https://github.com/foo/bar/blob/master/src/file.txt#L10"
                },
                "singleLine": {
                    "line": 10,
                    "startColumn": 20,
                    "endColumn": 30,
                    "result": "https://github.com/foo/bar/blob/master/src/file.txt#L10"
                },
                "multipleLines": {
                    "startLine": 10,
                    "startColumn": 20,
                    "endLine": 30,
                    "endColumn": 40,
                    "result": "https://github.com/foo/bar/blob/master/src/file.txt#L10-L30"
                }
            }
        }
    }
}
